{
  "$schema": "https://json-schema.org/draft/2020-12/schema",
  "$id": "https://omniproject.dev/vendors/backend.schema.json",
  "title": "OmniProject backend vendor",
  "description": "A system-of-record backend: the neutral manifest plus its n8n binding. One file per vendor under vendors/backends/<id>.json.",
  "type": "object",
  "additionalProperties": false,
  "required": ["id", "label", "docsUrl", "primaryRecord", "verification", "via", "requiredEnv", "capabilities", "authHeader", "actions"],
  "properties": {
    "id": { "type": "string", "pattern": "^[a-z0-9-]+$" },
    "label": { "type": "string" },
    "docsUrl": { "type": "string" },
    "primaryRecord": {
      "enum": ["issue", "invoice", "client", "product", "payment", "credit_note", "quote", "tax_rate", "vendor", "expense", "bill", "purchase_order", "gl_account", "journal_entry", "bank_account", "bank_transaction", "fx_rate", "fiscal_period", "dimension"],
      "description": "The primary record this backend is a system of record for. Decides the required contract read verbs and which field superset applies — a backend need not be a project tool, but it must own a record type. \"issue\": PM/CRM/ITSM/ERP tools (normalised to the issue/project contract). \"invoice\": a billing system of record (Invoice Ninja, Dolibarr, …). \"client\": a customer master whose primary record is the bill-to party. \"product\": an item catalogue whose primary record is the priced line item. \"payment\": an AR-receipt system whose primary record is a settlement applied to invoices. \"credit_note\" / \"quote\": AR documents (a credit against an account, an estimate that precedes an invoice). \"tax_rate\": a jurisdiction's tax-rate table."
    },
    "verification": {
      "enum": ["verified", "catalogued", "experimental"],
      "description": "How confident we are this manifest matches the vendor's real, live API. \"catalogued\": built from public docs, not yet run against a live instance. \"verified\": exercised end-to-end against a live instance. \"experimental\": speculative/partial, or a generic placeholder."
    },
    "via": { "type": "string", "description": "How this backend authenticates / is wired (human-readable, for the wizard)." },
    "requiredEnv": { "type": "array", "items": { "type": "string" } },
    "capabilities": { "type": "object", "additionalProperties": { "type": "boolean" } },
    "kind": { "enum": ["live", "import", "database"] },
    "adminOnly": { "type": "boolean" },
    "notes": { "type": "string" },
    "credentialType": { "type": "string" },
    "keyFormat": {
      "type": "object",
      "additionalProperties": false,
      "description": "The shape of the key required to reach this vendor (used to hard-reject keyless access and to scaffold credentials).",
      "required": ["scheme"],
      "properties": {
        "scheme": { "enum": ["psk", "bearer", "apiKey", "basic", "oauth2", "per-user", "none"] },
        "env": { "type": "array", "items": { "type": "string" } },
        "header": { "type": "string" },
        "pattern": { "type": "string" }
      }
    },
    "nomenclature": {
      "type": "object",
      "description": "Canonical label-catalogue key → this vendor's preferred word (a one-click nomenclature preset).",
      "additionalProperties": { "type": "string" }
    },
    "fields": {
      "type": "array",
      "description": "Canonical fields this backend CONTRIBUTES to the superset (each validated against assets/schema/field.schema.json by gen-fields and merged in, dedup by key). Use when a backend exposes a field not yet in the registry.",
      "items": { "type": "object" }
    },
    "fieldKeys": {
      "type": "array",
      "description": "Canonical field keys this backend exposes/maps. MUST be a strict subset of the superset — enforced by the guard-superset CI check (a backend can only reference fields that exist).",
      "items": { "type": "string" }
    },
    "statusVocabulary": {
      "type": "object",
      "additionalProperties": false,
      "required": ["toCanonical"],
      "description": "This vendor's native status dialect mapped to canonical statuses (data, below the seam).",
      "properties": {
        "toCanonical": { "type": "object", "additionalProperties": { "type": "string" } },
        "fromCanonical": { "type": "object", "additionalProperties": { "type": "string" } }
      }
    },
    "authHeader": { "type": "string", "description": "n8n expression for the per-user Authorization header value." },
    "actions": {
      "type": "object",
      "additionalProperties": {
        "type": "object",
        "additionalProperties": false,
        "properties": {
          "kind": { "enum": ["http", "n8nNode"] },
          "method": { "enum": ["GET", "POST", "PATCH", "PUT", "DELETE"] },
          "url": { "type": "string" },
          "body": { "type": "string" },
          "credentialType": { "type": "string" },
          "node": { "type": "string" },
          "typeVersion": { "type": "number" },
          "parameters": { "type": "object" },
          "note": { "type": "string" }
        }
      }
    },
    "invoiceSync": {
      "type": "object",
      "additionalProperties": false,
      "required": ["correlation", "env", "outbound", "inbound", "webhook"],
      "description": "Advertised invoice-sync mapping applied by the gateway's generic projector (broker/backends/invoice-mapping) — maps OmniProject's agnostic invoice surface to/from this backend's billing API, both ways, as data. Only needed by a backend that reconciles an external settlement onto the local sealed invoice.",
      "properties": {
        "correlation": { "type": "object" },
        "env": { "type": "object" },
        "outbound": { "type": "object" },
        "inbound": { "type": "object" },
        "webhook": { "type": "object" }
      }
    }
  }
}
